{
  "schemaVersion": 1,
  "network": {
    "name": "Robinhood Chain",
    "chainId": 4663,
    "rpcUrl": "https://rpc.mainnet.chain.robinhood.com",
    "explorerUrl": "https://robinhoodchain.blockscout.com"
  },
  "evidence": {
    "retrievedAt": "2026-09-17T15:59:45Z",
    "block": {
      "number": "65483446",
      "hash": "0x36f3bc6c90ad8c7f616a28d4fa779d6a80707a62c9a02288a1e02e94c46b0d30",
      "timestamp": "2026-09-17T15:43:54.000Z",
      "l1BlockNumber": "25998181",
      "finality": "finalized"
    }
  },
  "sources": [
    {
      "name": "Robinhood Chain connection parameters",
      "url": "https://docs.robinhood.com/chain/connecting/",
      "retrievedAt": "2026-09-14T09:54:56Z"
    },
    {
      "name": "Robinhood canonical token contracts",
      "url": "https://docs.robinhood.com/chain/contracts/",
      "retrievedAt": "2026-09-14T09:54:56Z"
    },
    {
      "name": "Robinhood oracle and Stock Token controls",
      "url": "https://docs.robinhood.com/chain/oracles-and-price-feeds/",
      "retrievedAt": "2026-09-14T09:54:56Z"
    },
    {
      "name": "Morpho market configuration",
      "url": "https://api.morpho.org/v0/blue/markets/4663:0xdeb4782d012d5fd3b24962538c2f6559049d70bda4dabd2e4212dacb96c28d45",
      "retrievedAt": "2026-09-17T15:59:45Z"
    },
    {
      "name": "Pinned Robinhood archive state",
      "url": "https://rpc.ordofi.network",
      "retrievedAt": "2026-09-17T15:59:45Z",
      "blockNumber": "65483446",
      "note": "Independent keyless archive RPC from the EIP-3085 chain registry; canonical finalized block hash cross-checked with Blockscout and read from successor block 65483447."
    },
    {
      "name": "Pinned Morpho Vault V2 state",
      "url": "https://rpc.ordofi.network",
      "retrievedAt": "2026-09-17T15:59:45Z",
      "blockNumber": "65483446",
      "note": "Direct total-assets, total-supply, idle-balance, route, fee, gate, and governance reads at the finalized evidence block."
    },
    {
      "name": "Pinned Vault V2 withdrawal inputs",
      "url": "https://rpc.ordofi.network",
      "retrievedAt": "2026-09-17T15:59:45Z",
      "blockNumber": "65483446",
      "note": "Normal and force liquidity derived from pinned adapter positions and canonical Morpho market liquidity; Vault V2 max functions were queried separately."
    },
    {
      "name": "Pinned Morpho Vault V2 allocations and caps",
      "url": "https://rpc.ordofi.network",
      "retrievedAt": "2026-09-17T15:59:45Z",
      "blockNumber": "65483446",
      "note": "Direct allocation, absolute-cap, and relative-cap reads for every configured adapter market."
    },
    {
      "name": "Morpho Vault V2 pending governance",
      "url": "https://api.morpho.org/v0/vaults-v2/4663:0xBeEff033F34C046626B8D0A041844C5d1A5409dd/pending-governance-actions",
      "retrievedAt": "2026-09-17T15:59:45Z",
      "blockNumber": "65492922"
    },
    {
      "name": "Morpho market APY averages",
      "url": "https://api.morpho.org/v0/blue/markets/4663:0xdeb4782d012d5fd3b24962538c2f6559049d70bda4dabd2e4212dacb96c28d45/apy-averages",
      "retrievedAt": "2026-09-17T15:59:45Z",
      "blockNumber": "65492922"
    },
    {
      "name": "Morpho Vault V2 APY averages",
      "url": "https://api.morpho.org/v1/vaults-v2/4663:0xBeEff033F34C046626B8D0A041844C5d1A5409dd/apy-averages",
      "retrievedAt": "2026-09-17T15:59:45Z",
      "blockNumber": "65492922"
    },
    {
      "name": "Morpho Vault V2 max-function semantics",
      "url": "https://docs.morpho.org/build/earn/concepts/vault-v2/",
      "retrievedAt": "2026-09-14T09:54:56Z",
      "note": "Vault V2 deliberately returns zero from all four ERC-4626 max functions."
    },
    {
      "name": "ERC-4626 rounding semantics",
      "url": "https://eips.ethereum.org/EIPS/eip-4626",
      "retrievedAt": "2026-09-14T09:54:56Z"
    }
  ],
  "contracts": {
    "morpho": {
      "address": "0x9D53d5E3bd5E8d4CbfA6DB1ca238AEA02E651010",
      "codeHash": "0x753b54fdb48c87c9c1ba1dcc3a330faac1a401a3bd23b43104b7b92409ecb424",
      "source": "https://robinhoodchain.blockscout.com/api/v2/smart-contracts/0x9D53d5E3bd5E8d4CbfA6DB1ca238AEA02E651010",
      "contractName": "Morpho",
      "proxyType": null
    },
    "loanToken": {
      "address": "0x5fc5360D0400a0Fd4f2af552ADD042D716F1d168",
      "codeHash": "0x864cc9ad53b338b82da1f7cab85ab0b3d5c8861acb422b6fec63cf36234f36a6",
      "source": "https://robinhoodchain.blockscout.com/api/v2/smart-contracts/0x5fc5360D0400a0Fd4f2af552ADD042D716F1d168",
      "contractName": "ERC1967Proxy",
      "proxyType": "eip1967",
      "decimals": 6,
      "symbol": "USDG"
    },
    "collateralToken": {
      "address": "0xaF3D76f1834A1d425780943C99Ea8A608f8a93f9",
      "codeHash": "0x6c1fdd40002dcb440c7fff6a84171404d279ccb057803b65826f7546acd65630",
      "source": "https://robinhoodchain.blockscout.com/api/v2/smart-contracts/0xaF3D76f1834A1d425780943C99Ea8A608f8a93f9",
      "contractName": "BeaconProxy",
      "proxyType": "beacon",
      "decimals": 18,
      "symbol": "AAPL"
    },
    "oracle": {
      "address": "0xD625d488D552775D2867194C618B945E5dDfE097",
      "codeHash": "0x1fbc6d30920a1b8cca852864460f317c72a14a6b7228f3fae202152b7d2f9fd3",
      "source": "https://robinhoodchain.blockscout.com/api/v2/smart-contracts/0xD625d488D552775D2867194C618B945E5dDfE097",
      "contractName": "StaticOracle",
      "proxyType": null
    },
    "irm": {
      "address": "0x2BD3d5965B26B51814AC95127B2b80dD6CcC0fa1",
      "codeHash": "0x27bdf07d4b41c5785e200e5d27ae0eb734a7573049196ac686a2c9bf3473b97b",
      "source": "https://robinhoodchain.blockscout.com/api/v2/smart-contracts/0x2BD3d5965B26B51814AC95127B2b80dD6CcC0fa1",
      "contractName": "AdaptiveCurveIrm",
      "proxyType": null
    },
    "vault": {
      "address": "0xBeEff033F34C046626B8D0A041844C5d1A5409dd",
      "codeHash": "0x3492098028b641c5949beebf8c56898f1ed846f42b59978ed7c75249603c1f6e",
      "source": "https://robinhoodchain.blockscout.com/api/v2/smart-contracts/0xBeEff033F34C046626B8D0A041844C5d1A5409dd",
      "contractName": "VaultV2",
      "proxyType": null
    },
    "vaultAdapter": {
      "address": "0x44ABc1d6cCFF2696d98890B92E2157AF242179c2",
      "codeHash": "0x78f72dee842a438cc21750b36673fdeeb88d9379ffd477ff934a3bd4851b4b50",
      "source": "https://robinhoodchain.blockscout.com/api/v2/smart-contracts/0x44ABc1d6cCFF2696d98890B92E2157AF242179c2",
      "contractName": "MorphoMarketV1AdapterV2",
      "proxyType": null
    },
    "collateralFeed": {
      "address": "0x6b22a786baa607d76728168703a39ea9c99f2cd0",
      "codeHash": "0xbd6f524cdc4268b6bd1bb6f77a8821faeea9c52ee9e0afa0b6d948ce82c966c2",
      "source": "https://robinhoodchain.blockscout.com/api/v2/smart-contracts/0x6b22a786baa607d76728168703a39ea9c99f2cd0",
      "contractName": "EACAggregatorProxy",
      "proxyType": null
    },
    "loanFeed": {
      "address": "0x61b7e5650328764b076a108eff5fa7282a1b9ad2",
      "codeHash": "0xbd6f524cdc4268b6bd1bb6f77a8821faeea9c52ee9e0afa0b6d948ce82c966c2",
      "source": "https://robinhoodchain.blockscout.com/api/v2/smart-contracts/0x61b7e5650328764b076a108eff5fa7282a1b9ad2",
      "contractName": "EACAggregatorProxy",
      "proxyType": null
    }
  },
  "market": {
    "id": "0xdeb4782d012d5fd3b24962538c2f6559049d70bda4dabd2e4212dacb96c28d45",
    "derivedId": "0xdeb4782d012d5fd3b24962538c2f6559049d70bda4dabd2e4212dacb96c28d45",
    "loanToken": "0x5fc5360D0400a0Fd4f2af552ADD042D716F1d168",
    "collateralToken": "0xaF3D76f1834A1d425780943C99Ea8A608f8a93f9",
    "oracle": "0xD625d488D552775D2867194C618B945E5dDfE097",
    "irm": "0x2BD3d5965B26B51814AC95127B2b80dD6CcC0fa1",
    "lltv": "625000000000000000",
    "state": {
      "observedBlockNumber": "65483446",
      "totalSupplyAssets": "239020403890",
      "totalSupplyShares": "238805362585313912",
      "totalBorrowAssets": "222298156026",
      "totalBorrowShares": "222073571953179044",
      "lastAccrualTimestamp": "1789629846",
      "fee": "0"
    },
    "oracleState": {
      "price": "333702483330720726732405916",
      "collateralRound": "18446744073709552254",
      "collateralAnswer": "33348367165",
      "collateralUpdatedAt": "1789654347",
      "loanRound": "18446744073709551721",
      "loanAnswer": "99991000",
      "loanUpdatedAt": "1789659304",
      "checkedAtBlockTimestamp": "1789659834"
    },
    "liquidityAssets": "44537532539292",
    "plannedBorrowAssets": "1000000000"
  },
  "vault": {
    "address": "0xBeEff033F34C046626B8D0A041844C5d1A5409dd",
    "codeHash": "0x3492098028b641c5949beebf8c56898f1ed846f42b59978ed7c75249603c1f6e",
    "asset": "0x5fc5360D0400a0Fd4f2af552ADD042D716F1d168",
    "generation": "Morpho Vault V2",
    "factory": "0x0FBad98595b0186dA120E41f77C102beb49f803c",
    "governance": {
      "owner": "0xCa50D23F1c18C1Dfaff5d3cae3aa4B9dC5C8db73",
      "curator": "0x9023FBD6A08C666491A2d1648737E400cF42D2Fb",
      "timelockSeconds": "604800",
      "adapterRegistry": "0xe785a2eFD384BA7B95BaEd3851BC76aeD67C676f",
      "liquidityAdapter": "0x44ABc1d6cCFF2696d98890B92E2157AF242179c2",
      "pendingCapExecutableAt": null,
      "pendingActionsObservedBlockNumber": "65492922"
    },
    "fees": {
      "management": "0",
      "performance": "0",
      "maxRatePerSecondWad": "63419583967"
    },
    "gates": {
      "receiveShares": null,
      "sendShares": null,
      "receiveAssets": null,
      "sendAssets": null
    },
    "maxFunctions": {
      "maxDeposit": "0",
      "maxMint": "0",
      "maxWithdraw": "0",
      "maxRedeem": "0",
      "interpretation": "Vault V2 deliberately returns zero; use fresh withdrawal options plus exact simulation and post-state."
    },
    "state": {
      "observedBlockNumber": "65483446",
      "totalAssets": "466456605203511",
      "totalSupply": "463113092195993201592181498",
      "idleAssets": "0",
      "allocatedAssets": "466456605203511",
      "sharePriceRay": "1007219646915321488459496036"
    },